URL,Version,Status,OIDs,Name,Title,Descriptino,Uses,Used,Sources
http://hl7.org/fhir/ValueSet/ucum-bodyweight,4.0.1,draft,"2.16.840.1.113883.4.642.3.956",BodyWeightUnits,Body Weight Units,"UCUM units for recording Body Weight","StructureDefinition/VA.MHV.bodyWeight","UCUM"
http://hl7.org/fhir/ValueSet/ucum-vitals-common,4.0.1,draft,"2.16.840.1.113883.4.642.3.955",VitalSignsUnits,Vital Signs Units,"Common UCUM units for recording Vital Signs","StructureDefinition/VA.MHV.bodyTemperature,StructureDefinition/VA.MHV.respirationRate,StructureDefinition/VA.MHV.bloodPressure,StructureDefinition/VA.MHV.heartRate,StructureDefinition/VA.MHV.bloodOxygenSat,StructureDefinition/VA.MHV.bodyWeight","UCUM"
http://terminology.hl7.org/ValueSet/v3-ActCode,2.0.0,active,,ActCode,v3 Code System ActCode,"A code specifying the particular kind of Act that the Act-instance represents within its class.  Constraints:  The kind of Act (e.g. physical examination, serum potassium, inpatient encounter, charge financial transaction, etc.) is specified with a code from one of several, typically external, coding systems.  The coding system will depend on the class of Act, such as LOINC for observations, etc. Conceptually, the Act.code must be a specialization of the Act.classCode. This is why the structure of ActClass domain should be reflected in the superstructure of the ActCode domain and then individual codes or externally referenced vocabularies subordinated under these domains that reflect the ActClass structure. Act.classCode and Act.code are not modifiers of each other but the Act.code concept should really imply the Act.classCode concept. For a negative example, it is not appropriate to use an Act.code ""potassium"" together with and Act.classCode for ""laboratory observation"" to somehow mean ""potassium laboratory observation"" and then use the same Act.code for ""potassium"" together with Act.classCode for ""medication"" to mean ""substitution of potassium"". This mutually modifying use of Act.code and Act.classCode is not permitted.","StructureDefinition/VA.MHV.BlueComposition","THO (V3)"
http://terminology.hl7.org/ValueSet/v3-ConfidentialityClassification,2014-03-26,active,"2.16.840.1.113883.1.11.10228",v3.ConfidentialityClassification,V3 Value SetConfidentialityClassification," Set of codes used to value Act.Confidentiality and Role.Confidentiality attribute in accordance with the definition for concept domain ""Confidentiality"".","StructureDefinition/VA.MHV.BlueComposition","THO (V3)"
http://terminology.hl7.org/ValueSet/v3-Ethnicity,2.0.0,active,"2.16.840.1.113883.1.11.15836",Ethnicity,Ethnicity,"In the United States, federal standards for classifying data on ethnicity determine the categories used by federal agencies and exert a strong influence on categorization by state and local agencies and private sector organizations. The federal standards do not conceptually define ethnicity, and they recognize the absence of an anthropological or scientific basis for ethnicity classification. Instead, the federal standards acknowledge that ethnicity is a social-political construct in which an individual's own identification with a particular ethnicity is preferred to observer identification. The standards specify two minimum ethnicity categories: Hispanic or Latino, and Not Hispanic or Latino. The standards define a Hispanic or Latino as a person of ""Mexican, Puerto Rican, Cuban, South or Central America, or other Spanish culture or origin, regardless of race."" The standards stipulate that ethnicity data need not be limited to the two minimum categories, but any expansion must be collapsible to those categories. In addition, the standards stipulate that an individual can be Hispanic or Latino or can be Not Hispanic or Latino, but cannot be both.","StructureDefinition/FM-Ethnicity","THO (V3)"
http://terminology.hl7.org/ValueSet/v3-FamilyMember,2.0.0,active,"2.16.840.1.113883.1.11.19579",FamilyMember,FamilyMember,"A relationship between two people characterizing their ""familial"" relationship","StructureDefinition/VA.MHV.familymemberhistory","THO (V3)"
http://terminology.hl7.org/ValueSet/v3-Race,2.0.0,active,"2.16.840.1.113883.1.11.14914",Race,Race,"In the United States, federal standards for classifying data on race determine the categories used by federal agencies and exert a strong influence on categorization by state and local agencies and private sector organizations. The federal standards do not conceptually define race, and they recognize the absence of an anthropological or scientific basis for racial classification. Instead, the federal standards acknowledge that race is a social-political construct in which an individual's own identification with one more race categories is preferred to observer identification. The standards use a variety of features to define five minimum race categories. Among these features are descent from ""the original peoples"" of a specified region or nation. The minimum race categories are American Indian or Alaska Native, Asian, Black or African American, Native Hawaiian or Other Pacific Islander, and White. The federal standards stipulate that race data need not be limited to the five minimum categories, but any expansion must be collapsible to those categories.","StructureDefinition/FM-Race","THO (V3)"
https://johnmoehrke.github.io/MHV-PGHD/ValueSet/AgesVS,0.2.10-beta,active,,AgesVS,Ages ValueSet,"ValueSet of the Ages allowed",,"Internal"
https://johnmoehrke.github.io/MHV-PGHD/ValueSet/AllAppIdCodes,0.2.10-beta,active,,AllAppIdCodes,PGD App Id Codes,"All valid App ID codes",,"Internal"
https://johnmoehrke.github.io/MHV-PGHD/ValueSet/mhv-blood-pressure-positions,0.2.10-beta,active,,MHVbloodPressurePositions,The methods of measurement for blood pressure that MHV supports,"These are the loinc body positions that MHV supports on blood pressure.",,"LOINC"
https://johnmoehrke.github.io/MHV-PGHD/ValueSet/mhv-blood-sugar-methods-sites,0.2.10-beta,active,,MHVbloodSugarMethods,The methods of measurement for blood sugar that MHV supports,"These are the SNOMED body sites that MHV supports.","StructureDefinition/VA.MHV.bloodSugar","SCT"
https://johnmoehrke.github.io/MHV-PGHD/ValueSet/mhv-body-temperature-sites,0.2.10-beta,active,,MHVbodyTemperatureSites,The body temperature measurement sites that MHV supports,"These are the SNOMED body sites that MHV supports.","StructureDefinition/VA.MHV.bodyTemperature","SCT"
https://johnmoehrke.github.io/MHV-PGHD/ValueSet/mhv-body-temperatures,0.2.10-beta,active,,MHVbodyTemperatures,The body temperature measurement types that MHV supports,"These are the UCUM types that MHV supports.",,"UCUM"
https://johnmoehrke.github.io/MHV-PGHD/ValueSet/mhv-body-weights,0.2.10-beta,active,,MHVbodyWeights,The body weight measurement types that MHV supports,"These are the UCUM types that MHV supports. This is a subset of the full bodyWeight types (which also brings in grams. Others might also include stone).",,"UCUM"
https://johnmoehrke.github.io/MHV-PGHD/ValueSet/mhv-medication-routes,0.2.10-beta,active,,MHVmedicationRoutes,The routes of medication that MHV supports,"These are the SNOMED-CT routes for medications that MHV supports.","StructureDefinition/VA.MHV.medication","SCT"
