URL,Version,Status,OIDs,Name,Title,Descriptino,Uses,Used,Sources
http://cts.nlm.nih.gov/fhir/ValueSet/2.16.840.1.113762.1.4.1010.6,20210630,active,,CVX Vaccines Administered Vaccine Set,null,"","StructureDefinition/VA.MHV.immunization","hl7.terminology.r4"
http://cts.nlm.nih.gov/fhir/ValueSet/2.16.840.1.113762.1.4.1186.8,20210622,active,,Common substances for allergy and intolerance documentation including refutations,null,"","StructureDefinition/VA.MHV.allergy",
http://hl7.org/fhir/ValueSet/additional-instruction-codes,4.0.1,draft,"2.16.840.1.113883.4.642.3.95",SNOMEDCTAdditionalDosageInstructions,SNOMED CT Additional Dosage Instructions,"This value set includes all SNOMED CT Additional Dosage Instructions.","StructureDefinition/VA.MHV.medication","SCT"
http://hl7.org/fhir/ValueSet/administration-method-codes,4.0.1,draft,"2.16.840.1.113883.4.642.3.97",SNOMEDCTAdministrationMethodCodes,SNOMED CT Administration Method Codes,"This value set includes some method codes from SNOMED CT - provided as an exemplar","StructureDefinition/VA.MHV.medication","SCT"
http://hl7.org/fhir/ValueSet/administrative-gender,4.0.1,active,"2.16.840.1.113883.4.642.3.1",AdministrativeGender,AdministrativeGender,"The gender of a person used for administrative purposes.","StructureDefinition/VA.MHV.familymemberhistory","hl7.fhir.r4.core"
http://hl7.org/fhir/ValueSet/allergy-intolerance-category,4.0.1,draft,"2.16.840.1.113883.4.642.3.133",AllergyIntoleranceCategory,AllergyIntoleranceCategory,"Category of an identified substance associated with allergies or intolerances.","StructureDefinition/VA.MHV.allergy","hl7.fhir.r4.core"
http://hl7.org/fhir/ValueSet/allergy-intolerance-criticality,4.0.1,draft,"2.16.840.1.113883.4.642.3.129",AllergyIntoleranceCriticality,AllergyIntoleranceCriticality,"Estimate of the potential clinical harm, or seriousness, of a reaction to an identified substance.","StructureDefinition/VA.MHV.allergy","hl7.fhir.r4.core"
http://hl7.org/fhir/ValueSet/allergy-intolerance-type,4.0.1,draft,"2.16.840.1.113883.4.642.3.131",AllergyIntoleranceType,AllergyIntoleranceType,"Identification of the underlying physiological mechanism for a Reaction Risk.","StructureDefinition/VA.MHV.allergy","hl7.fhir.r4.core"
http://hl7.org/fhir/ValueSet/allergyintolerance-clinical,4.0.1,draft,"2.16.840.1.113883.4.642.3.1372",AllergyIntoleranceClinicalStatusCodes,AllergyIntolerance Clinical Status Codes,"Preferred value set for AllergyIntolerance Clinical Status.","StructureDefinition/VA.MHV.allergy","THO"
http://hl7.org/fhir/ValueSet/allergyintolerance-verification,4.0.1,draft,"2.16.840.1.113883.4.642.3.1370",AllergyIntoleranceVerificationStatusCodes,AllergyIntolerance Verification Status Codes,"Preferred value set for AllergyIntolerance Verification Status.","StructureDefinition/VA.MHV.allergy","THO"
http://hl7.org/fhir/ValueSet/approach-site-codes,4.0.1,draft,"2.16.840.1.113883.4.642.3.346",SNOMEDCTAnatomicalStructureForAdministrationSiteCodes,SNOMED CT Anatomical Structure for Administration Site Codes,"This value set includes Anatomical Structure codes from SNOMED CT - provided as an exemplar.","StructureDefinition/VA.MHV.medication","SCT"
http://hl7.org/fhir/ValueSet/body-site,4.0.1,draft,"2.16.840.1.113883.4.642.3.141",SNOMEDCTBodyStructures,SNOMED CT Body Structures,"This value set includes all codes from [SNOMED CT](http://snomed.info/sct) where concept is-a 442083009 (Anatomical or acquired body site (body structure)).","StructureDefinition/VA.MHV.respirationRate,StructureDefinition/VA.MHV.bloodPressure,StructureDefinition/VA.MHV.heartRate,StructureDefinition/VA.MHV.bloodOxygenSat,StructureDefinition/VA.MHV.bodyWeight,StructureDefinition/VA.MHV.pain,StructureDefinition/VA.MHV.bloodSugar","SCT"
http://hl7.org/fhir/ValueSet/bundle-type,4.0.1,active,"2.16.840.1.113883.4.642.3.620",BundleType,BundleType,"Indicates the purpose of a bundle - how it is intended to be used.","StructureDefinition/VA.MHV.BlueBundle","hl7.fhir.r4.core"
http://hl7.org/fhir/ValueSet/clinical-findings,4.0.1,draft,"2.16.840.1.113883.4.642.3.232",SNOMEDCTClinicalFindings,SNOMED CT Clinical Findings,"This value set includes all the ""Clinical finding"" [SNOMED CT](http://snomed.info/sct) codes - concepts where concept is-a 404684003 (Clinical finding (finding)).","StructureDefinition/VA.MHV.allergy,StructureDefinition/VA.MHV.familymemberhistory","SCT"
http://hl7.org/fhir/ValueSet/common-tags,4.0.1,draft,"2.16.840.1.113883.4.642.3.79",CommonTags,Common Tags,"Common Tag Codes defined by FHIR project","StructureDefinition/VA.MHV.BlueBundle,StructureDefinition/VA.MHV.heartRate,StructureDefinition/VA.MHV.medication,StructureDefinition/VA.MHV.allergy,StructureDefinition/VA.MHV.familymemberhistory,StructureDefinition/VA.MHV.bodyTemperature,StructureDefinition/VA.MHV.BlueComposition,StructureDefinition/VA.MHV.respirationRate,StructureDefinition/VA.MHV.bloodPressure,StructureDefinition/VA.MHV.bloodOxygenSat,StructureDefinition/VA.MHV.immunization,StructureDefinition/VA.MHV.bodyWeight,StructureDefinition/VA.MHV.bloodSugar,StructureDefinition/VA.MHV.pain","THO"
http://hl7.org/fhir/ValueSet/composition-attestation-mode,4.0.1,draft,"2.16.840.1.113883.4.642.3.238",CompositionAttestationMode,CompositionAttestationMode,"The way in which a person authenticated a composition.","StructureDefinition/VA.MHV.BlueComposition","hl7.fhir.r4.core"
http://hl7.org/fhir/ValueSet/composition-status,4.0.1,draft,"2.16.840.1.113883.4.642.3.241",CompositionStatus,CompositionStatus,"The workflow/clinical status of the composition.","StructureDefinition/VA.MHV.BlueComposition","hl7.fhir.r4.core"
http://hl7.org/fhir/ValueSet/condition-code,4.0.1,draft,"2.16.840.1.113883.4.642.3.161",Condition/Problem/DiagnosisCodes,Condition/Problem/Diagnosis Codes,"Example value set for Condition/Problem/Diagnosis codes.","StructureDefinition/VA.MHV.medication,StructureDefinition/VA.MHV.familymemberhistory","SCT"
http://hl7.org/fhir/ValueSet/condition-outcome,4.0.1,draft,"2.16.840.1.113883.4.642.3.967",ConditionOutcomeCodes,Condition Outcome Codes,"Example value set for condition outcomes.","StructureDefinition/VA.MHV.familymemberhistory","SCT"
http://hl7.org/fhir/ValueSet/data-absent-reason,4.0.1,active,"2.16.840.1.113883.4.642.3.5",DataAbsentReason,DataAbsentReason,"Used to specify why the normally expected content of the data element is missing.","StructureDefinition/VA.MHV.bodyTemperature,StructureDefinition/VA.MHV.respirationRate,StructureDefinition/VA.MHV.bloodPressure,StructureDefinition/VA.MHV.heartRate,StructureDefinition/VA.MHV.bloodOxygenSat,StructureDefinition/VA.MHV.bodyWeight,StructureDefinition/VA.MHV.pain,StructureDefinition/VA.MHV.bloodSugar","THO"
http://hl7.org/fhir/ValueSet/doc-section-codes,4.0.1,draft,"2.16.840.1.113883.4.642.3.237",DocumentSectionCodes,Document Section Codes,"Document section codes (LOINC codes used in CCDA sections).","StructureDefinition/VA.MHV.BlueComposition","LOINC"
http://hl7.org/fhir/ValueSet/doc-typecodes,4.0.1,draft,"2.16.840.1.113883.4.642.3.240",FHIRDocumentTypeCodes,FHIR Document Type Codes,"FHIR Document Codes - all LOINC codes where scale type = 'DOC'.","StructureDefinition/VA.MHV.BlueComposition","LOINC"
http://hl7.org/fhir/ValueSet/document-classcodes,4.0.1,active,"2.16.840.1.113883.3.88.12.80.46",DocumentClassValueSet,Document Class Value Set,"This is the code specifying the high-level kind of document (e.g. Prescription, Discharge Summary, Report, etc.). Note: Class code for documents comes from LOINC, and is based upon one of the following:The type of service described by the document. It is described at a very high level in Section 7.3 of the LOINC Manual. The type study performed. It was determined by identifying modalities for study reports. The section of the chart where the document is placed. It was determined from the SETs created for Claims Attachment requests.","StructureDefinition/VA.MHV.BlueComposition","LOINC"
http://hl7.org/fhir/ValueSet/document-relationship-type,4.0.1,draft,"2.16.840.1.113883.4.642.3.244",DocumentRelationshipType,DocumentRelationshipType,"The type of relationship between documents.","StructureDefinition/VA.MHV.BlueComposition","hl7.fhir.r4.core"
http://hl7.org/fhir/ValueSet/dose-rate-type,4.0.1,draft,"2.16.840.1.113883.4.642.3.981",DoseAndRateType,DoseAndRateType,"The kind of dose or rate specified.","StructureDefinition/VA.MHV.medication","THO"
http://hl7.org/fhir/ValueSet/history-absent-reason,4.0.1,draft,"2.16.840.1.113883.4.642.3.269",FamilyHistoryAbsentReason,FamilyHistoryAbsentReason,"Codes describing the reason why a family member's history is not available.","StructureDefinition/VA.MHV.familymemberhistory","THO"
http://hl7.org/fhir/ValueSet/history-status,4.0.1,draft,"2.16.840.1.113883.4.642.3.267",FamilyHistoryStatus,FamilyHistoryStatus,"A code that identifies the status of the family history record.","StructureDefinition/VA.MHV.familymemberhistory","hl7.fhir.r4.core"
http://hl7.org/fhir/ValueSet/http-verb,4.0.1,active,"2.16.840.1.113883.4.642.3.624",HTTPVerb,HTTPVerb,"HTTP verbs (in the HTTP command line). See [HTTP rfc](https://tools.ietf.org/html/rfc7231) for details.","StructureDefinition/VA.MHV.BlueBundle","hl7.fhir.r4.core"
http://hl7.org/fhir/ValueSet/immunization-function,4.0.1,draft,"2.16.840.1.113883.4.642.3.995",ImmunizationFunctionCodes,Immunization Function Codes,"The value set to instantiate this attribute should be drawn from a terminologically robust code system that consists of or contains concepts to support describing the function a practitioner or organization may play in the immunization event. This value set is provided as a suggestive example.","StructureDefinition/VA.MHV.immunization","THO (V2)"
http://hl7.org/fhir/ValueSet/immunization-funding-source,4.0.1,draft,"2.16.840.1.113883.4.642.3.293",ImmunizationFundingSource,Immunization Funding Source,"The value set to instantiate this attribute should be drawn from a terminologically robust code system that consists of or contains concepts to support describing the source of the vaccine administered. This value set is provided as a suggestive example.","StructureDefinition/VA.MHV.immunization","THO"
http://hl7.org/fhir/ValueSet/immunization-origin,4.0.1,draft,"2.16.840.1.113883.4.642.3.296",ImmunizationOriginCodes,Immunization Origin Codes,"The value set to instantiate this attribute should be drawn from a terminologically robust code system that consists of or contains concepts to support describing the source of the data when the report of the immunization event is not based on information from the person, entity or organization who administered the vaccine. This value set is provided as a suggestive example.","StructureDefinition/VA.MHV.immunization","THO"
http://hl7.org/fhir/ValueSet/immunization-program-eligibility,4.0.1,draft,"2.16.840.1.113883.4.642.3.291",ImmunizationProgramEligibility,Immunization Program Eligibility,"The value set to instantiate this attribute should be drawn from a terminologically robust code system that consists of or contains concepts to support describing the patient's eligibility for a vaccination program. This value set is provided as a suggestive example.","StructureDefinition/VA.MHV.immunization","THO"
http://hl7.org/fhir/ValueSet/immunization-reason,4.0.1,draft,"2.16.840.1.113883.4.642.3.290",ImmunizationReasonCodes,Immunization Reason Codes,"The value set to instantiate this attribute should be drawn from a terminologically robust code system that consists of or contains concepts to support describing the reason why a dose of vaccine was administered. This value set is provided as a suggestive example.","StructureDefinition/VA.MHV.immunization","SCT"
http://hl7.org/fhir/ValueSet/immunization-route,4.0.1,draft,"2.16.840.1.113883.4.642.3.289",ImmunizationRouteCodes,Immunization Route Codes,"The value set to instantiate this attribute should be drawn from a terminologically robust code system that consists of or contains concepts to support describing the administrative routes used during vaccination. This value set is provided as a suggestive example.","StructureDefinition/VA.MHV.immunization","THO (V3)"
http://hl7.org/fhir/ValueSet/immunization-site,4.0.1,draft,"2.16.840.1.113883.4.642.3.288",CodesForImmunizationSiteOfAdministration,Codes for Immunization Site of Administration,"The value set to instantiate this attribute should be drawn from a terminologically robust code system that consists of or contains concepts to support describing the body site where the vaccination occurred. This value set is provided as a suggestive example.","StructureDefinition/VA.MHV.immunization","THO (V3)"
http://hl7.org/fhir/ValueSet/immunization-status,4.0.1,draft,"2.16.840.1.113883.4.642.3.295",ImmunizationStatusCodes,Immunization Status Codes,"The value set to instantiate this attribute should be drawn from a terminologically robust code system that consists of or contains concepts to support describing the current status of the administered dose of vaccine.","StructureDefinition/VA.MHV.immunization","hl7.fhir.r4.core"
http://hl7.org/fhir/ValueSet/immunization-status-reason,4.0.1,draft,"2.16.840.1.113883.4.642.3.992",ImmunizationStatusReasonCodes,Immunization Status Reason Codes,"The value set to instantiate this attribute should be drawn from a terminologically robust code system that consists of or contains concepts to support describing the reason why a dose of vaccine was not administered. This value set is provided as a suggestive example.","StructureDefinition/VA.MHV.immunization","THO (V3),SCT"
http://hl7.org/fhir/ValueSet/immunization-subpotent-reason,4.0.1,draft,"2.16.840.1.113883.4.642.3.993",ImmunizationSubpotentReason,Immunization Subpotent Reason,"The value set to instantiate this attribute should be drawn from a terminologically robust code system that consists of or contains concepts to support describing the reason why a dose is considered to be subpotent. This value set is provided as a suggestive example.","StructureDefinition/VA.MHV.immunization","THO"
http://hl7.org/fhir/ValueSet/immunization-target-disease,4.0.1,draft,"2.16.840.1.113883.4.642.3.1047",ImmunizationTargetDiseaseCodes,Immunization Target Disease Codes,"The value set to instantiate this attribute should be drawn from a terminologically robust code system that consists of or contains concepts to support describing the disease that the dose is being administered against. This value set is provided as a suggestive example and includes the SNOMED CT concepts from the 64572001 (Disease) hierarchy.","StructureDefinition/VA.MHV.immunization","SCT"
http://hl7.org/fhir/ValueSet/languages,4.0.1,draft,"2.16.840.1.113883.4.642.3.20",CommonLanguages,Common Languages,"This value set includes common codes from BCP-47 (http://tools.ietf.org/html/bcp47)","StructureDefinition/VA.MHV.BlueBundle,StructureDefinition/VA.MHV.heartRate,StructureDefinition/VA.MHV.medication,StructureDefinition/VA.MHV.allergy,StructureDefinition/VA.MHV.familymemberhistory,StructureDefinition/VA.MHV.bodyTemperature,StructureDefinition/VA.MHV.BlueComposition,StructureDefinition/VA.MHV.respirationRate,StructureDefinition/VA.MHV.bloodPressure,StructureDefinition/VA.MHV.bloodOxygenSat,StructureDefinition/VA.MHV.immunization,StructureDefinition/VA.MHV.bodyWeight,StructureDefinition/VA.MHV.bloodSugar,StructureDefinition/VA.MHV.pain","hl7.terminology.r4"
http://hl7.org/fhir/ValueSet/list-empty-reason,4.0.1,draft,"2.16.840.1.113883.4.642.3.322",ListEmptyReasons,List Empty Reasons,"General reasons for a list to be empty. Reasons are either related to a summary list (i.e. problem or medication list) or to a workflow related list (i.e. consultation list).","StructureDefinition/VA.MHV.BlueComposition","THO"
http://hl7.org/fhir/ValueSet/list-mode,4.0.1,draft,"2.16.840.1.113883.4.642.3.318",ListMode,ListMode,"The processing mode that applies to this list.","StructureDefinition/VA.MHV.BlueComposition","hl7.fhir.r4.core"
http://hl7.org/fhir/ValueSet/list-order,4.0.1,draft,"2.16.840.1.113883.4.642.3.324",ListOrderCodes,List Order Codes,"Base values for the order of the items in a list resource.","StructureDefinition/VA.MHV.BlueComposition","THO"
http://hl7.org/fhir/ValueSet/medication-as-needed-reason,4.0.1,draft,"2.16.840.1.113883.4.642.3.96",SNOMEDCTMedicationAsNeededReasonCodes,SNOMED CT Medication As Needed Reason Codes,"This value set includes all clinical findings from SNOMED CT - provided as an exemplar value set.","StructureDefinition/VA.MHV.medication","SCT"
http://hl7.org/fhir/ValueSet/medication-codes,4.0.1,draft,"2.16.840.1.113883.4.642.3.375",SNOMEDCTMedicationCodes,SNOMED CT Medication Codes,"This value set includes all drug or medicament substance codes and all pharmaceutical/biologic products from SNOMED CT - provided as an exemplar value set.","StructureDefinition/VA.MHV.medication","SCT"
http://hl7.org/fhir/ValueSet/medication-statement-category,4.0.1,draft,"2.16.840.1.113883.4.642.3.370",Medication usage category codes,Medication usage category codes,"Medication Status Codes","StructureDefinition/VA.MHV.medication","THO"
http://hl7.org/fhir/ValueSet/medication-statement-status,4.0.1,draft,"2.16.840.1.113883.4.642.3.367",Medication Status Codes,Medication  status  codes,"Medication Status Codes","StructureDefinition/VA.MHV.medication","hl7.fhir.r4.core"
http://hl7.org/fhir/ValueSet/observation-category,4.0.1,draft,"2.16.840.1.113883.4.642.3.403",ObservationCategoryCodes,Observation Category Codes,"Observation Category codes.","StructureDefinition/VA.MHV.bodyTemperature,StructureDefinition/VA.MHV.respirationRate,StructureDefinition/VA.MHV.bloodPressure,StructureDefinition/VA.MHV.heartRate,StructureDefinition/VA.MHV.bloodOxygenSat,StructureDefinition/VA.MHV.bodyWeight,StructureDefinition/VA.MHV.pain,StructureDefinition/VA.MHV.bloodSugar","THO"
http://hl7.org/fhir/ValueSet/observation-codes,4.0.1,draft,"2.16.840.1.113883.4.642.3.396",LOINCCodes,LOINC Codes,"This value set includes all LOINC codes","StructureDefinition/VA.MHV.pain,StructureDefinition/VA.MHV.bloodSugar","LOINC"
http://hl7.org/fhir/ValueSet/observation-interpretation,4.0.1,active,"2.16.840.1.113883.4.642.3.399",ObservationInterpretationCodes,Observation Interpretation Codes,"A categorical assessment, providing a rough qualitative interpretation of the observation value,    such as “normal”/ “abnormal”,”low” / “high”, “better” / “worse”, “susceptible” / “resistant”, “expected”/ “not expected”.    The value set is intended to be for ANY use where coded representation of an interpretation is needed.             Notes:          This is being communicated in v2.x in OBX-8 (Observation Interpretation), in v3 in ObservationInterpretation (CWE) in R1 (Representative Realm) and in FHIR in    Observation.interpretation. Historically these values come from the laboratory domain, and these codes are extensively    used. The value set binding is extensible, so codes outside the value set that are needed for interpretation concepts    (i.e. particular meanings) that are not included in the value set can be used, and these new codes may also be added to    the value set and published in a future version.","StructureDefinition/VA.MHV.bodyTemperature,StructureDefinition/VA.MHV.respirationRate,StructureDefinition/VA.MHV.bloodPressure,StructureDefinition/VA.MHV.heartRate,StructureDefinition/VA.MHV.bloodOxygenSat,StructureDefinition/VA.MHV.bodyWeight,StructureDefinition/VA.MHV.pain,StructureDefinition/VA.MHV.bloodSugar","THO (V3)"
http://hl7.org/fhir/ValueSet/observation-methods,4.0.1,draft,"2.16.840.1.113883.4.642.3.395",ObservationMethods,Observation Methods,"Observation Method codes from [SNOMED CT](http://snomed.info/sct) where concept is-a 272394005 (Technique (qualifier value)) or is-a 129264002 (Action (qualifier value)) or is-a 386053000 (Evaluation procedure(procedure))","StructureDefinition/VA.MHV.bodyTemperature,StructureDefinition/VA.MHV.respirationRate,StructureDefinition/VA.MHV.bloodPressure,StructureDefinition/VA.MHV.heartRate,StructureDefinition/VA.MHV.bloodOxygenSat,StructureDefinition/VA.MHV.bodyWeight,StructureDefinition/VA.MHV.pain","SCT"
http://hl7.org/fhir/ValueSet/observation-status,4.0.1,active,"2.16.840.1.113883.4.642.3.400",ObservationStatus,ObservationStatus,"Codes providing the status of an observation.","StructureDefinition/VA.MHV.bodyTemperature,StructureDefinition/VA.MHV.respirationRate,StructureDefinition/VA.MHV.bloodPressure,StructureDefinition/VA.MHV.heartRate,StructureDefinition/VA.MHV.bloodOxygenSat,StructureDefinition/VA.MHV.bodyWeight,StructureDefinition/VA.MHV.pain,StructureDefinition/VA.MHV.bloodSugar","hl7.fhir.r4.core"
http://hl7.org/fhir/ValueSet/observation-vitalsignresult,4.0.1,active,"2.16.840.1.113883.3.88.12.80.62",VitalSigns,Vital Signs,"This value set indicates the allowed vital sign result types.   The LOINC code for Vitals Signs panel (85353-1) is a grouping structure for a set of vital signs and includes related links (with type=has-member) to the Observations in this set (e.g. respiratory rate, heart rate, BP).  The Blood pressure panel (85354-9) is used to group the component observations Systolic blood pressure (8480-6) and Diastolic blood pressure (8462-4).","StructureDefinition/VA.MHV.bodyTemperature,StructureDefinition/VA.MHV.respirationRate,StructureDefinition/VA.MHV.bloodPressure,StructureDefinition/VA.MHV.heartRate,StructureDefinition/VA.MHV.bloodOxygenSat,StructureDefinition/VA.MHV.bodyWeight","LOINC"
http://hl7.org/fhir/ValueSet/quantity-comparator,4.0.1,active,"2.16.840.1.113883.4.642.3.59",QuantityComparator,QuantityComparator,"How the Quantity should be understood and represented.","StructureDefinition/VA.MHV.bodyTemperature,StructureDefinition/VA.MHV.respirationRate,StructureDefinition/VA.MHV.bloodPressure,StructureDefinition/VA.MHV.heartRate,StructureDefinition/VA.MHV.bloodOxygenSat,StructureDefinition/VA.MHV.bodyWeight,StructureDefinition/VA.MHV.pain,StructureDefinition/VA.MHV.bloodSugar","hl7.fhir.r4.core"
http://hl7.org/fhir/ValueSet/reaction-event-severity,4.0.1,draft,"2.16.840.1.113883.4.642.3.135",AllergyIntoleranceSeverity,AllergyIntoleranceSeverity,"Clinical assessment of the severity of a reaction event as a whole, potentially considering multiple different manifestations.","StructureDefinition/VA.MHV.allergy","hl7.fhir.r4.core"
http://hl7.org/fhir/ValueSet/reason-medication-status-codes,4.0.1,draft,"2.16.840.1.113883.4.642.3.369",SNOMEDCTDrugTherapyStatusCodes,SNOMED CT Drug Therapy Status codes ,"This value set includes some taken and not taken reason codes from SNOMED CT - provided as an exemplar","StructureDefinition/VA.MHV.medication","SCT"
http://hl7.org/fhir/ValueSet/referencerange-appliesto,4.0.1,draft,"2.16.840.1.113883.4.642.3.407",ObservationReferenceRangeAppliesToCodes,Observation Reference Range Applies To Codes,"This value set defines a set of codes that can be used to indicate the particular target population the reference range applies to.","StructureDefinition/VA.MHV.bodyTemperature,StructureDefinition/VA.MHV.respirationRate,StructureDefinition/VA.MHV.bloodPressure,StructureDefinition/VA.MHV.heartRate,StructureDefinition/VA.MHV.bloodOxygenSat,StructureDefinition/VA.MHV.bodyWeight,StructureDefinition/VA.MHV.pain,StructureDefinition/VA.MHV.bloodSugar","SCT"
http://hl7.org/fhir/ValueSet/referencerange-meaning,4.0.1,draft,"2.16.840.1.113883.4.642.3.397",ObservationReferenceRangeMeaningCodes,Observation Reference Range Meaning Codes,"This value set defines a set of codes that can be used to indicate the meaning/use of a reference range for a particular target population.","StructureDefinition/VA.MHV.bodyTemperature,StructureDefinition/VA.MHV.respirationRate,StructureDefinition/VA.MHV.bloodPressure,StructureDefinition/VA.MHV.heartRate,StructureDefinition/VA.MHV.bloodOxygenSat,StructureDefinition/VA.MHV.bodyWeight,StructureDefinition/VA.MHV.pain,StructureDefinition/VA.MHV.bloodSugar","THO"
http://hl7.org/fhir/ValueSet/route-codes,4.0.1,draft,"2.16.840.1.113883.4.642.3.98",SNOMEDCTRouteCodes,SNOMED CT Route Codes,"This value set includes all Route codes from SNOMED CT - provided as an exemplar.","StructureDefinition/VA.MHV.allergy","SCT"
http://hl7.org/fhir/ValueSet/search-entry-mode,4.0.1,active,"2.16.840.1.113883.4.642.3.622",SearchEntryMode,SearchEntryMode,"Why an entry is in the result set - whether it's included as a match or because of an _include requirement, or to convey information or warning information about the search process.","StructureDefinition/VA.MHV.BlueBundle","hl7.fhir.r4.core"
http://hl7.org/fhir/ValueSet/security-labels,4.0.1,active,"2.16.840.1.113883.4.642.3.47",All Security Labels,SecurityLabels,"A single value set for all security labels defined by FHIR.","StructureDefinition/VA.MHV.BlueBundle,StructureDefinition/VA.MHV.heartRate,StructureDefinition/VA.MHV.medication,StructureDefinition/VA.MHV.allergy,StructureDefinition/VA.MHV.familymemberhistory,StructureDefinition/VA.MHV.bodyTemperature,StructureDefinition/VA.MHV.BlueComposition,StructureDefinition/VA.MHV.respirationRate,StructureDefinition/VA.MHV.bloodPressure,StructureDefinition/VA.MHV.bloodOxygenSat,StructureDefinition/VA.MHV.immunization,StructureDefinition/VA.MHV.bodyWeight,StructureDefinition/VA.MHV.bloodSugar,StructureDefinition/VA.MHV.pain",
http://hl7.org/fhir/ValueSet/substance-code,4.0.1,draft,"2.16.840.1.113883.4.642.3.473",SubstanceCode,Substance Code,"This value set contains concept codes for specific substances. It includes codes from [SNOMED](http://snomed.info/sct) where concept is-a 105590001 (Substance (substance)) and where concept is-a 373873005 (Pharmaceutical / biologic product (product))","StructureDefinition/VA.MHV.allergy","SCT"
http://hl7.org/fhir/ValueSet/ucum-bodytemp,4.0.1,draft,"2.16.840.1.113883.4.642.3.957",BodyTemperatureUnits,Body Temperature Units,"UCUM units for recording Body Temperature","StructureDefinition/VA.MHV.bodyTemperature","UCUM"
